Question,Answer
What is the Genre of Star Wars: Episode VII - The Force Awakens?,"Star Wars: Episode VII - The Force Awakens is of Action, Adventure, Sci-Fi genre. Summary: As a new threat to the galaxy rises, Rey, a desert scavenger, and Finn, an ex-stormtrooper, must join Han Solo and Chewbacca to search for the one hope of restoring peace."
Who is the Director of Star Wars: Episode VII - The Force Awakens?,"The Director of Star Wars: Episode VII - The Force Awakens is J.J. Abrams. Summary: As a new threat to the galaxy rises, Rey, a desert scavenger, and Finn, an ex-stormtrooper, must join Han Solo and Chewbacca to search for the one hope of restoring peace."
What is the IMDB Rating of Star Wars: Episode VII - The Force Awakens?,"The IMDB Rating of Star Wars: Episode VII - The Force Awakens is 7.9. Summary: As a new threat to the galaxy rises, Rey, a desert scavenger, and Finn, an ex-stormtrooper, must join Han Solo and Chewbacca to search for the one hope of restoring peace."
What is the Runtime of Star Wars: Episode VII - The Force Awakens?,"The Runtime of Star Wars: Episode VII - The Force Awakens is 138. Summary: As a new threat to the galaxy rises, Rey, a desert scavenger, and Finn, an ex-stormtrooper, must join Han Solo and Chewbacca to search for the one hope of restoring peace."
What is the Genre of Before Midnight?,"Before Midnight is of Drama, Romance genre. Summary: We meet Jesse and Celine nine years on in Greece. Almost two decades have passed since their first meeting on that train bound for Vienna."
Who is the Director of Before Midnight?,The Director of Before Midnight is Richard Linklater. Summary: We meet Jesse and Celine nine years on in Greece. Almost two decades have passed since their first meeting on that train bound for Vienna.
What is the IMDB Rating of Before Midnight?,The IMDB Rating of Before Midnight is 7.9. Summary: We meet Jesse and Celine nine years on in Greece. Almost two decades have passed since their first meeting on that train bound for Vienna.
What is the Runtime of Before Midnight?,The Runtime of Before Midnight is 109. Summary: We meet Jesse and Celine nine years on in Greece. Almost two decades have passed since their first meeting on that train bound for Vienna.
What is the Genre of X-Men: Days of Future Past?,"X-Men: Days of Future Past is of Action, Adventure, Sci-Fi genre. Summary: The X-Men send Wolverine to the past in a desperate effort to change history and prevent an event that results in doom for both humans and mutants."
Who is the Director of X-Men: Days of Future Past?,The Director of X-Men: Days of Future Past is Bryan Singer. Summary: The X-Men send Wolverine to the past in a desperate effort to change history and prevent an event that results in doom for both humans and mutants.
What is the IMDB Rating of X-Men: Days of Future Past?,The IMDB Rating of X-Men: Days of Future Past is 7.9. Summary: The X-Men send Wolverine to the past in a desperate effort to change history and prevent an event that results in doom for both humans and mutants.
What is the Runtime of X-Men: Days of Future Past?,The Runtime of X-Men: Days of Future Past is 132. Summary: The X-Men send Wolverine to the past in a desperate effort to change history and prevent an event that results in doom for both humans and mutants.
What is the Genre of Bir Zamanlar Anadolu'da?,"Bir Zamanlar Anadolu'da is of Crime, Drama genre. Summary: A group of men set out in search of a dead body in the Anatolian steppes."
Who is the Director of Bir Zamanlar Anadolu'da?,The Director of Bir Zamanlar Anadolu'da is Nuri Bilge Ceylan. Summary: A group of men set out in search of a dead body in the Anatolian steppes.
What is the IMDB Rating of Bir Zamanlar Anadolu'da?,The IMDB Rating of Bir Zamanlar Anadolu'da is 7.9. Summary: A group of men set out in search of a dead body in the Anatolian steppes.
What is the Runtime of Bir Zamanlar Anadolu'da?,The Runtime of Bir Zamanlar Anadolu'da is 157. Summary: A group of men set out in search of a dead body in the Anatolian steppes.
What is the Genre of The Artist?,"The Artist is of Comedy, Drama, Romance genre. Summary: An egomaniacal film star develops a relationship with a young dancer against the backdrop of Hollywood's silent era."
Who is the Director of The Artist?,The Director of The Artist is Michel Hazanavicius. Summary: An egomaniacal film star develops a relationship with a young dancer against the backdrop of Hollywood's silent era.
What is the IMDB Rating of The Artist?,The IMDB Rating of The Artist is 7.9. Summary: An egomaniacal film star develops a relationship with a young dancer against the backdrop of Hollywood's silent era.
What is the Runtime of The Artist?,The Runtime of The Artist is 100. Summary: An egomaniacal film star develops a relationship with a young dancer against the backdrop of Hollywood's silent era.
What is the Genre of Edge of Tomorrow?,"Edge of Tomorrow is of Action, Adventure, Sci-Fi genre. Summary: A soldier fighting aliens gets to relive the same day over and over again, the day restarting every time he dies."
Who is the Director of Edge of Tomorrow?,"The Director of Edge of Tomorrow is Doug Liman. Summary: A soldier fighting aliens gets to relive the same day over and over again, the day restarting every time he dies."
What is the IMDB Rating of Edge of Tomorrow?,"The IMDB Rating of Edge of Tomorrow is 7.9. Summary: A soldier fighting aliens gets to relive the same day over and over again, the day restarting every time he dies."
What is the Runtime of Edge of Tomorrow?,"The Runtime of Edge of Tomorrow is 113. Summary: A soldier fighting aliens gets to relive the same day over and over again, the day restarting every time he dies."
What is the Genre of Amour?,"Amour is of Drama, Romance genre. Summary: Georges and Anne are an octogenarian couple. They are cultivated, retired music teachers. Their daughter, also a musician, lives in Britain with her family. One day, Anne has a stroke, and the couple's bond of love is severely tested."
Who is the Director of Amour?,"The Director of Amour is Michael Haneke. Summary: Georges and Anne are an octogenarian couple. They are cultivated, retired music teachers. Their daughter, also a musician, lives in Britain with her family. One day, Anne has a stroke, and the couple's bond of love is severely tested."
What is the IMDB Rating of Amour?,"The IMDB Rating of Amour is 7.9. Summary: Georges and Anne are an octogenarian couple. They are cultivated, retired music teachers. Their daughter, also a musician, lives in Britain with her family. One day, Anne has a stroke, and the couple's bond of love is severely tested."
What is the Runtime of Amour?,"The Runtime of Amour is 127. Summary: Georges and Anne are an octogenarian couple. They are cultivated, retired music teachers. Their daughter, also a musician, lives in Britain with her family. One day, Anne has a stroke, and the couple's bond of love is severely tested."
What is the Genre of The Irishman?,"The Irishman is of Biography, Crime, Drama genre. Summary: An old man recalls his time painting houses for his friend, Jimmy Hoffa, through the 1950-70s."
Who is the Director of The Irishman?,"The Director of The Irishman is Martin Scorsese. Summary: An old man recalls his time painting houses for his friend, Jimmy Hoffa, through the 1950-70s."
What is the IMDB Rating of The Irishman?,"The IMDB Rating of The Irishman is 7.9. Summary: An old man recalls his time painting houses for his friend, Jimmy Hoffa, through the 1950-70s."
What is the Runtime of The Irishman?,"The Runtime of The Irishman is 209. Summary: An old man recalls his time painting houses for his friend, Jimmy Hoffa, through the 1950-70s."
What is the Genre of Un prophète?,"Un prophète is of Crime, Drama genre. Summary: A young Arab man is sent to a French prison."
Who is the Director of Un prophète?,The Director of Un prophète is Jacques Audiard. Summary: A young Arab man is sent to a French prison.
What is the IMDB Rating of Un prophète?,The IMDB Rating of Un prophète is 7.9. Summary: A young Arab man is sent to a French prison.
What is the Runtime of Un prophète?,The Runtime of Un prophète is 155. Summary: A young Arab man is sent to a French prison.
What is the Genre of Moon?,"Moon is of Drama, Mystery, Sci-Fi genre. Summary: Astronaut Sam Bell has a quintessentially personal encounter toward the end of his three-year stint on the Moon, where he, working alongside his computer, GERTY, sends back to Earth parcels of a resource that has helped diminish our planet's power problems."
Who is the Director of Moon?,"The Director of Moon is Duncan Jones. Summary: Astronaut Sam Bell has a quintessentially personal encounter toward the end of his three-year stint on the Moon, where he, working alongside his computer, GERTY, sends back to Earth parcels of a resource that has helped diminish our planet's power problems."
What is the IMDB Rating of Moon?,"The IMDB Rating of Moon is 7.9. Summary: Astronaut Sam Bell has a quintessentially personal encounter toward the end of his three-year stint on the Moon, where he, working alongside his computer, GERTY, sends back to Earth parcels of a resource that has helped diminish our planet's power problems."
What is the Runtime of Moon?,"The Runtime of Moon is 97. Summary: Astronaut Sam Bell has a quintessentially personal encounter toward the end of his three-year stint on the Moon, where he, working alongside his computer, GERTY, sends back to Earth parcels of a resource that has helped diminish our planet's power problems."
What is the Genre of Låt den rätte komma in?,"Låt den rätte komma in is of Crime, Drama, Fantasy genre. Summary: Oskar, an overlooked and bullied boy, finds love and revenge through Eli, a beautiful but peculiar girl."
Who is the Director of Låt den rätte komma in?,"The Director of Låt den rätte komma in is Tomas Alfredson. Summary: Oskar, an overlooked and bullied boy, finds love and revenge through Eli, a beautiful but peculiar girl."
What is the IMDB Rating of Låt den rätte komma in?,"The IMDB Rating of Låt den rätte komma in is 7.9. Summary: Oskar, an overlooked and bullied boy, finds love and revenge through Eli, a beautiful but peculiar girl."
What is the Runtime of Låt den rätte komma in?,"The Runtime of Låt den rätte komma in is 114. Summary: Oskar, an overlooked and bullied boy, finds love and revenge through Eli, a beautiful but peculiar girl."
What is the Genre of District 9?,"District 9 is of Action, Sci-Fi, Thriller genre. Summary: Violence ensues after an extraterrestrial race forced to live in slum-like conditions on Earth finds a kindred spirit in a government agent exposed to their biotechnology."
Who is the Director of District 9?,The Director of District 9 is Neill Blomkamp. Summary: Violence ensues after an extraterrestrial race forced to live in slum-like conditions on Earth finds a kindred spirit in a government agent exposed to their biotechnology.
What is the IMDB Rating of District 9?,The IMDB Rating of District 9 is 7.9. Summary: Violence ensues after an extraterrestrial race forced to live in slum-like conditions on Earth finds a kindred spirit in a government agent exposed to their biotechnology.
What is the Runtime of District 9?,The Runtime of District 9 is 112. Summary: Violence ensues after an extraterrestrial race forced to live in slum-like conditions on Earth finds a kindred spirit in a government agent exposed to their biotechnology.
What is the Genre of The Wrestler?,"The Wrestler is of Drama, Sport genre. Summary: A faded professional wrestler must retire, but finds his quest for a new life outside the ring a dispiriting struggle."
Who is the Director of The Wrestler?,"The Director of The Wrestler is Darren Aronofsky. Summary: A faded professional wrestler must retire, but finds his quest for a new life outside the ring a dispiriting struggle."
What is the IMDB Rating of The Wrestler?,"The IMDB Rating of The Wrestler is 7.9. Summary: A faded professional wrestler must retire, but finds his quest for a new life outside the ring a dispiriting struggle."
What is the Runtime of The Wrestler?,"The Runtime of The Wrestler is 109. Summary: A faded professional wrestler must retire, but finds his quest for a new life outside the ring a dispiriting struggle."
What is the Genre of Jab We Met?,"Jab We Met is of Comedy, Drama, Romance genre. Summary: A depressed wealthy businessman finds his life changing after he meets a spunky and care-free young woman."
Who is the Director of Jab We Met?,The Director of Jab We Met is Imtiaz Ali. Summary: A depressed wealthy businessman finds his life changing after he meets a spunky and care-free young woman.
What is the IMDB Rating of Jab We Met?,The IMDB Rating of Jab We Met is 7.9. Summary: A depressed wealthy businessman finds his life changing after he meets a spunky and care-free young woman.
What is the Runtime of Jab We Met?,The Runtime of Jab We Met is 138. Summary: A depressed wealthy businessman finds his life changing after he meets a spunky and care-free young woman.
What is the Genre of Boyhood?,"Boyhood is of Drama genre. Summary: The life of Mason, from early childhood to his arrival at college."
Who is the Director of Boyhood?,"The Director of Boyhood is Richard Linklater. Summary: The life of Mason, from early childhood to his arrival at college."
What is the IMDB Rating of Boyhood?,"The IMDB Rating of Boyhood is 7.9. Summary: The life of Mason, from early childhood to his arrival at college."
What is the Runtime of Boyhood?,"The Runtime of Boyhood is 165. Summary: The life of Mason, from early childhood to his arrival at college."
"What is the Genre of 4 luni, 3 saptamâni si 2 zile?","4 luni, 3 saptamâni si 2 zile is of Drama genre. Summary: A woman assists her friend in arranging an illegal abortion in 1980s Romania."
"Who is the Director of 4 luni, 3 saptamâni si 2 zile?","The Director of 4 luni, 3 saptamâni si 2 zile is Cristian Mungiu. Summary: A woman assists her friend in arranging an illegal abortion in 1980s Romania."
"What is the IMDB Rating of 4 luni, 3 saptamâni si 2 zile?","The IMDB Rating of 4 luni, 3 saptamâni si 2 zile is 7.9. Summary: A woman assists her friend in arranging an illegal abortion in 1980s Romania."
"What is the Runtime of 4 luni, 3 saptamâni si 2 zile?","The Runtime of 4 luni, 3 saptamâni si 2 zile is 113. Summary: A woman assists her friend in arranging an illegal abortion in 1980s Romania."
What is the Genre of Star Trek?,"Star Trek is of Action, Adventure, Sci-Fi genre. Summary: The brash James T. Kirk tries to live up to his father's legacy with Mr. Spock keeping him in check as a vengeful Romulan from the future creates black holes to destroy the Federation one planet at a time."
Who is the Director of Star Trek?,The Director of Star Trek is J.J. Abrams. Summary: The brash James T. Kirk tries to live up to his father's legacy with Mr. Spock keeping him in check as a vengeful Romulan from the future creates black holes to destroy the Federation one planet at a time.
What is the IMDB Rating of Star Trek?,The IMDB Rating of Star Trek is 7.9. Summary: The brash James T. Kirk tries to live up to his father's legacy with Mr. Spock keeping him in check as a vengeful Romulan from the future creates black holes to destroy the Federation one planet at a time.
What is the Runtime of Star Trek?,The Runtime of Star Trek is 127. Summary: The brash James T. Kirk tries to live up to his father's legacy with Mr. Spock keeping him in check as a vengeful Romulan from the future creates black holes to destroy the Federation one planet at a time.
What is the Genre of In Bruges?,"In Bruges is of Comedy, Crime, Drama genre. Summary: Guilt-stricken after a job gone wrong, hitman Ray and his partner await orders from their ruthless boss in Bruges, Belgium, the last place in the world Ray wants to be."
Who is the Director of In Bruges?,"The Director of In Bruges is Martin McDonagh. Summary: Guilt-stricken after a job gone wrong, hitman Ray and his partner await orders from their ruthless boss in Bruges, Belgium, the last place in the world Ray wants to be."
What is the IMDB Rating of In Bruges?,"The IMDB Rating of In Bruges is 7.9. Summary: Guilt-stricken after a job gone wrong, hitman Ray and his partner await orders from their ruthless boss in Bruges, Belgium, the last place in the world Ray wants to be."
What is the Runtime of In Bruges?,"The Runtime of In Bruges is 107. Summary: Guilt-stricken after a job gone wrong, hitman Ray and his partner await orders from their ruthless boss in Bruges, Belgium, the last place in the world Ray wants to be."
What is the Genre of The Man from Earth?,"The Man from Earth is of Drama, Fantasy, Mystery genre. Summary: An impromptu goodbye party for Professor John Oldman becomes a mysterious interrogation after the retiring scholar reveals to his colleagues he has a longer and stranger past than they can imagine."
Who is the Director of The Man from Earth?,The Director of The Man from Earth is Richard Schenkman. Summary: An impromptu goodbye party for Professor John Oldman becomes a mysterious interrogation after the retiring scholar reveals to his colleagues he has a longer and stranger past than they can imagine.
What is the IMDB Rating of The Man from Earth?,The IMDB Rating of The Man from Earth is 7.9. Summary: An impromptu goodbye party for Professor John Oldman becomes a mysterious interrogation after the retiring scholar reveals to his colleagues he has a longer and stranger past than they can imagine.
What is the Runtime of The Man from Earth?,The Runtime of The Man from Earth is 87. Summary: An impromptu goodbye party for Professor John Oldman becomes a mysterious interrogation after the retiring scholar reveals to his colleagues he has a longer and stranger past than they can imagine.
What is the Genre of Letters from Iwo Jima?,"Letters from Iwo Jima is of Action, Adventure, Drama genre. Summary: The story of the battle of Iwo Jima between the United States and Imperial Japan during World War II, as told from the perspective of the Japanese who fought it."
Who is the Director of Letters from Iwo Jima?,"The Director of Letters from Iwo Jima is Clint Eastwood. Summary: The story of the battle of Iwo Jima between the United States and Imperial Japan during World War II, as told from the perspective of the Japanese who fought it."
What is the IMDB Rating of Letters from Iwo Jima?,"The IMDB Rating of Letters from Iwo Jima is 7.9. Summary: The story of the battle of Iwo Jima between the United States and Imperial Japan during World War II, as told from the perspective of the Japanese who fought it."
What is the Runtime of Letters from Iwo Jima?,"The Runtime of Letters from Iwo Jima is 141. Summary: The story of the battle of Iwo Jima between the United States and Imperial Japan during World War II, as told from the perspective of the Japanese who fought it."
What is the Genre of The Fall?,"The Fall is of Adventure, Drama, Fantasy genre. Summary: In a hospital on the outskirts of 1920s Los Angeles, an injured stuntman begins to tell a fellow patient, a little girl with a broken arm, a fantastic story of five mythical heroes. Thanks to his fractured state of mind and her vivid imagination, the line between fiction and reality blurs as the tale advances."
Who is the Director of The Fall?,"The Director of The Fall is Tarsem Singh. Summary: In a hospital on the outskirts of 1920s Los Angeles, an injured stuntman begins to tell a fellow patient, a little girl with a broken arm, a fantastic story of five mythical heroes. Thanks to his fractured state of mind and her vivid imagination, the line between fiction and reality blurs as the tale advances."
What is the IMDB Rating of The Fall?,"The IMDB Rating of The Fall is 7.9. Summary: In a hospital on the outskirts of 1920s Los Angeles, an injured stuntman begins to tell a fellow patient, a little girl with a broken arm, a fantastic story of five mythical heroes. Thanks to his fractured state of mind and her vivid imagination, the line between fiction and reality blurs as the tale advances."
What is the Runtime of The Fall?,"The Runtime of The Fall is 117. Summary: In a hospital on the outskirts of 1920s Los Angeles, an injured stuntman begins to tell a fellow patient, a little girl with a broken arm, a fantastic story of five mythical heroes. Thanks to his fractured state of mind and her vivid imagination, the line between fiction and reality blurs as the tale advances."
What is the Genre of Life of Pi?,"Life of Pi is of Adventure, Drama, Fantasy genre. Summary: A young man who survives a disaster at sea is hurtled into an epic journey of adventure and discovery. While cast away, he forms an unexpected connection with another survivor: a fearsome Bengal tiger."
Who is the Director of Life of Pi?,"The Director of Life of Pi is Ang Lee. Summary: A young man who survives a disaster at sea is hurtled into an epic journey of adventure and discovery. While cast away, he forms an unexpected connection with another survivor: a fearsome Bengal tiger."
What is the IMDB Rating of Life of Pi?,"The IMDB Rating of Life of Pi is 7.9. Summary: A young man who survives a disaster at sea is hurtled into an epic journey of adventure and discovery. While cast away, he forms an unexpected connection with another survivor: a fearsome Bengal tiger."
What is the Runtime of Life of Pi?,"The Runtime of Life of Pi is 127. Summary: A young man who survives a disaster at sea is hurtled into an epic journey of adventure and discovery. While cast away, he forms an unexpected connection with another survivor: a fearsome Bengal tiger."
What is the Genre of Fantastic Mr. Fox?,"Fantastic Mr. Fox is of Animation, Adventure, Comedy genre. Summary: An urbane fox cannot resist returning to his farm raiding ways and then must help his community survive the farmers' retaliation."
Who is the Director of Fantastic Mr. Fox?,The Director of Fantastic Mr. Fox is Wes Anderson. Summary: An urbane fox cannot resist returning to his farm raiding ways and then must help his community survive the farmers' retaliation.
What is the IMDB Rating of Fantastic Mr. Fox?,The IMDB Rating of Fantastic Mr. Fox is 7.9. Summary: An urbane fox cannot resist returning to his farm raiding ways and then must help his community survive the farmers' retaliation.
What is the Runtime of Fantastic Mr. Fox?,The Runtime of Fantastic Mr. Fox is 87. Summary: An urbane fox cannot resist returning to his farm raiding ways and then must help his community survive the farmers' retaliation.
What is the Genre of C.R.A.Z.Y.?,"C.R.A.Z.Y. is of Comedy, Drama genre. Summary: A young French-Canadian, growing up in the 1960s and 1970s, struggles to reconcile his emerging homosexuality with his father's conservative values and his own Catholic beliefs."
Who is the Director of C.R.A.Z.Y.?,"The Director of C.R.A.Z.Y. is Jean-Marc Vallée. Summary: A young French-Canadian, growing up in the 1960s and 1970s, struggles to reconcile his emerging homosexuality with his father's conservative values and his own Catholic beliefs."
What is the IMDB Rating of C.R.A.Z.Y.?,"The IMDB Rating of C.R.A.Z.Y. is 7.9. Summary: A young French-Canadian, growing up in the 1960s and 1970s, struggles to reconcile his emerging homosexuality with his father's conservative values and his own Catholic beliefs."
What is the Runtime of C.R.A.Z.Y.?,"The Runtime of C.R.A.Z.Y. is 129. Summary: A young French-Canadian, growing up in the 1960s and 1970s, struggles to reconcile his emerging homosexuality with his father's conservative values and his own Catholic beliefs."
What is the Genre of Les choristes?,"Les choristes is of Drama, Music genre. Summary: The new teacher at a severely administered boys' boarding school works to positively affect the students' lives through music."
Who is the Director of Les choristes?,The Director of Les choristes is Christophe Barratier. Summary: The new teacher at a severely administered boys' boarding school works to positively affect the students' lives through music.
What is the IMDB Rating of Les choristes?,The IMDB Rating of Les choristes is 7.9. Summary: The new teacher at a severely administered boys' boarding school works to positively affect the students' lives through music.
What is the Runtime of Les choristes?,The Runtime of Les choristes is 97. Summary: The new teacher at a severely administered boys' boarding school works to positively affect the students' lives through music.
What is the Genre of Iron Man?,"Iron Man is of Action, Adventure, Sci-Fi genre. Summary: After being held captive in an Afghan cave, billionaire engineer Tony Stark creates a unique weaponized suit of armor to fight evil."
Who is the Director of Iron Man?,"The Director of Iron Man is Jon Favreau. Summary: After being held captive in an Afghan cave, billionaire engineer Tony Stark creates a unique weaponized suit of armor to fight evil."
What is the IMDB Rating of Iron Man?,"The IMDB Rating of Iron Man is 7.9. Summary: After being held captive in an Afghan cave, billionaire engineer Tony Stark creates a unique weaponized suit of armor to fight evil."
What is the Runtime of Iron Man?,"The Runtime of Iron Man is 126. Summary: After being held captive in an Afghan cave, billionaire engineer Tony Stark creates a unique weaponized suit of armor to fight evil."
What is the Genre of Shaun of the Dead?,"Shaun of the Dead is of Comedy, Horror genre. Summary: A man's uneventful life is disrupted by the zombie apocalypse."
Who is the Director of Shaun of the Dead?,The Director of Shaun of the Dead is Edgar Wright. Summary: A man's uneventful life is disrupted by the zombie apocalypse.
What is the IMDB Rating of Shaun of the Dead?,The IMDB Rating of Shaun of the Dead is 7.9. Summary: A man's uneventful life is disrupted by the zombie apocalypse.
