Question,Answer
Who is the Director of Captain America: The Winter Soldier?,"The Director of Captain America: The Winter Soldier is Anthony Russo. Summary: As Steve Rogers struggles to embrace his role in the modern world, he teams up with a fellow Avenger and S.H.I.E.L.D agent, Black Widow, to battle a new threat from history: an assassin known as the Winter Soldier."
What is the IMDB Rating of Captain America: The Winter Soldier?,"The IMDB Rating of Captain America: The Winter Soldier is 7.7. Summary: As Steve Rogers struggles to embrace his role in the modern world, he teams up with a fellow Avenger and S.H.I.E.L.D agent, Black Widow, to battle a new threat from history: an assassin known as the Winter Soldier."
What is the Runtime of Captain America: The Winter Soldier?,"The Runtime of Captain America: The Winter Soldier is 136. Summary: As Steve Rogers struggles to embrace his role in the modern world, he teams up with a fellow Avenger and S.H.I.E.L.D agent, Black Widow, to battle a new threat from history: an assassin known as the Winter Soldier."
What is the Genre of Rockstar?,"Rockstar is of Drama, Music, Musical genre. Summary: Janardhan Jakhar chases his dreams of becoming a big Rock star, during which he falls in love with Heer."
Who is the Director of Rockstar?,"The Director of Rockstar is Imtiaz Ali. Summary: Janardhan Jakhar chases his dreams of becoming a big Rock star, during which he falls in love with Heer."
What is the IMDB Rating of Rockstar?,"The IMDB Rating of Rockstar is 7.7. Summary: Janardhan Jakhar chases his dreams of becoming a big Rock star, during which he falls in love with Heer."
What is the Runtime of Rockstar?,"The Runtime of Rockstar is 159. Summary: Janardhan Jakhar chases his dreams of becoming a big Rock star, during which he falls in love with Heer."
What is the Genre of Nebraska?,"Nebraska is of Adventure, Comedy, Drama genre. Summary: An aging, booze-addled father makes the trip from Montana to Nebraska with his estranged son in order to claim a million-dollar Mega Sweepstakes Marketing prize."
Who is the Director of Nebraska?,"The Director of Nebraska is Alexander Payne. Summary: An aging, booze-addled father makes the trip from Montana to Nebraska with his estranged son in order to claim a million-dollar Mega Sweepstakes Marketing prize."
What is the IMDB Rating of Nebraska?,"The IMDB Rating of Nebraska is 7.7. Summary: An aging, booze-addled father makes the trip from Montana to Nebraska with his estranged son in order to claim a million-dollar Mega Sweepstakes Marketing prize."
What is the Runtime of Nebraska?,"The Runtime of Nebraska is 115. Summary: An aging, booze-addled father makes the trip from Montana to Nebraska with his estranged son in order to claim a million-dollar Mega Sweepstakes Marketing prize."
What is the Genre of Wreck-It Ralph?,"Wreck-It Ralph is of Animation, Adventure, Comedy genre. Summary: A video game villain wants to be a hero and sets out to fulfill his dream, but his quest brings havoc to the whole arcade where he lives."
Who is the Director of Wreck-It Ralph?,"The Director of Wreck-It Ralph is Rich Moore. Summary: A video game villain wants to be a hero and sets out to fulfill his dream, but his quest brings havoc to the whole arcade where he lives."
What is the IMDB Rating of Wreck-It Ralph?,"The IMDB Rating of Wreck-It Ralph is 7.7. Summary: A video game villain wants to be a hero and sets out to fulfill his dream, but his quest brings havoc to the whole arcade where he lives."
What is the Runtime of Wreck-It Ralph?,"The Runtime of Wreck-It Ralph is 101. Summary: A video game villain wants to be a hero and sets out to fulfill his dream, but his quest brings havoc to the whole arcade where he lives."
What is the Genre of Le Petit Prince?,"Le Petit Prince is of Animation, Adventure, Drama genre. Summary: A little girl lives in a very grown-up world with her mother, who tries to prepare her for it. Her neighbor, the Aviator, introduces the girl to an extraordinary world where anything is possible, the world of the Little Prince."
Who is the Director of Le Petit Prince?,"The Director of Le Petit Prince is Mark Osborne. Summary: A little girl lives in a very grown-up world with her mother, who tries to prepare her for it. Her neighbor, the Aviator, introduces the girl to an extraordinary world where anything is possible, the world of the Little Prince."
What is the IMDB Rating of Le Petit Prince?,"The IMDB Rating of Le Petit Prince is 7.7. Summary: A little girl lives in a very grown-up world with her mother, who tries to prepare her for it. Her neighbor, the Aviator, introduces the girl to an extraordinary world where anything is possible, the world of the Little Prince."
What is the Runtime of Le Petit Prince?,"The Runtime of Le Petit Prince is 108. Summary: A little girl lives in a very grown-up world with her mother, who tries to prepare her for it. Her neighbor, the Aviator, introduces the girl to an extraordinary world where anything is possible, the world of the Little Prince."
What is the Genre of Detachment?,Detachment is of Drama genre. Summary: A substitute teacher who drifts from classroom to classroom finds a connection to the students and teachers during his latest assignment.
Who is the Director of Detachment?,The Director of Detachment is Tony Kaye. Summary: A substitute teacher who drifts from classroom to classroom finds a connection to the students and teachers during his latest assignment.
What is the IMDB Rating of Detachment?,The IMDB Rating of Detachment is 7.7. Summary: A substitute teacher who drifts from classroom to classroom finds a connection to the students and teachers during his latest assignment.
What is the Runtime of Detachment?,The Runtime of Detachment is 98. Summary: A substitute teacher who drifts from classroom to classroom finds a connection to the students and teachers during his latest assignment.
What is the Genre of Midnight in Paris?,"Midnight in Paris is of Comedy, Fantasy, Romance genre. Summary: While on a trip to Paris with his fiancée's family, a nostalgic screenwriter finds himself mysteriously going back to the 1920s every day at midnight."
Who is the Director of Midnight in Paris?,"The Director of Midnight in Paris is Woody Allen. Summary: While on a trip to Paris with his fiancée's family, a nostalgic screenwriter finds himself mysteriously going back to the 1920s every day at midnight."
What is the IMDB Rating of Midnight in Paris?,"The IMDB Rating of Midnight in Paris is 7.7. Summary: While on a trip to Paris with his fiancée's family, a nostalgic screenwriter finds himself mysteriously going back to the 1920s every day at midnight."
What is the Runtime of Midnight in Paris?,"The Runtime of Midnight in Paris is 96. Summary: While on a trip to Paris with his fiancée's family, a nostalgic screenwriter finds himself mysteriously going back to the 1920s every day at midnight."
What is the Genre of The Lego Movie?,"The Lego Movie is of Animation, Action, Adventure genre. Summary: An ordinary LEGO construction worker, thought to be the prophesied as ""special"", is recruited to join a quest to stop an evil tyrant from gluing the LEGO universe into eternal stasis."
Who is the Director of The Lego Movie?,"The Director of The Lego Movie is Christopher Miller. Summary: An ordinary LEGO construction worker, thought to be the prophesied as ""special"", is recruited to join a quest to stop an evil tyrant from gluing the LEGO universe into eternal stasis."
What is the IMDB Rating of The Lego Movie?,"The IMDB Rating of The Lego Movie is 7.7. Summary: An ordinary LEGO construction worker, thought to be the prophesied as ""special"", is recruited to join a quest to stop an evil tyrant from gluing the LEGO universe into eternal stasis."
What is the Runtime of The Lego Movie?,"The Runtime of The Lego Movie is 100. Summary: An ordinary LEGO construction worker, thought to be the prophesied as ""special"", is recruited to join a quest to stop an evil tyrant from gluing the LEGO universe into eternal stasis."
What is the Genre of Gravity?,"Gravity is of Drama, Sci-Fi, Thriller genre. Summary: Two astronauts work together to survive after an accident leaves them stranded in space."
Who is the Director of Gravity?,The Director of Gravity is Alfonso Cuarón. Summary: Two astronauts work together to survive after an accident leaves them stranded in space.
What is the IMDB Rating of Gravity?,The IMDB Rating of Gravity is 7.7. Summary: Two astronauts work together to survive after an accident leaves them stranded in space.
What is the Runtime of Gravity?,The Runtime of Gravity is 91. Summary: Two astronauts work together to survive after an accident leaves them stranded in space.
What is the Genre of Star Trek Into Darkness?,"Star Trek Into Darkness is of Action, Adventure, Sci-Fi genre. Summary: After the crew of the Enterprise find an unstoppable force of terror from within their own organization, Captain Kirk leads a manhunt to a war-zone world to capture a one-man weapon of mass destruction."
Who is the Director of Star Trek Into Darkness?,"The Director of Star Trek Into Darkness is J.J. Abrams. Summary: After the crew of the Enterprise find an unstoppable force of terror from within their own organization, Captain Kirk leads a manhunt to a war-zone world to capture a one-man weapon of mass destruction."
What is the IMDB Rating of Star Trek Into Darkness?,"The IMDB Rating of Star Trek Into Darkness is 7.7. Summary: After the crew of the Enterprise find an unstoppable force of terror from within their own organization, Captain Kirk leads a manhunt to a war-zone world to capture a one-man weapon of mass destruction."
What is the Runtime of Star Trek Into Darkness?,"The Runtime of Star Trek Into Darkness is 132. Summary: After the crew of the Enterprise find an unstoppable force of terror from within their own organization, Captain Kirk leads a manhunt to a war-zone world to capture a one-man weapon of mass destruction."
What is the Genre of Beasts of No Nation?,"Beasts of No Nation is of Drama, War genre. Summary: A drama based on the experiences of Agu, a child soldier fighting in the civil war of an unnamed African country."
Who is the Director of Beasts of No Nation?,"The Director of Beasts of No Nation is Cary Joji Fukunaga. Summary: A drama based on the experiences of Agu, a child soldier fighting in the civil war of an unnamed African country."
What is the IMDB Rating of Beasts of No Nation?,"The IMDB Rating of Beasts of No Nation is 7.7. Summary: A drama based on the experiences of Agu, a child soldier fighting in the civil war of an unnamed African country."
What is the Runtime of Beasts of No Nation?,"The Runtime of Beasts of No Nation is 137. Summary: A drama based on the experiences of Agu, a child soldier fighting in the civil war of an unnamed African country."
What is the Genre of The Social Network?,"The Social Network is of Biography, Drama genre. Summary: As Harvard student Mark Zuckerberg creates the social networking site that would become known as Facebook, he is sued by the twins who claimed he stole their idea, and by the co-founder who was later squeezed out of the business."
Who is the Director of The Social Network?,"The Director of The Social Network is David Fincher. Summary: As Harvard student Mark Zuckerberg creates the social networking site that would become known as Facebook, he is sued by the twins who claimed he stole their idea, and by the co-founder who was later squeezed out of the business."
What is the IMDB Rating of The Social Network?,"The IMDB Rating of The Social Network is 7.7. Summary: As Harvard student Mark Zuckerberg creates the social networking site that would become known as Facebook, he is sued by the twins who claimed he stole their idea, and by the co-founder who was later squeezed out of the business."
What is the Runtime of The Social Network?,"The Runtime of The Social Network is 120. Summary: As Harvard student Mark Zuckerberg creates the social networking site that would become known as Facebook, he is sued by the twins who claimed he stole their idea, and by the co-founder who was later squeezed out of the business."
What is the Genre of X: First Class?,"X: First Class is of Action, Adventure, Sci-Fi genre. Summary: In the 1960s, superpowered humans Charles Xavier and Erik Lensherr work together to find others like them, but Erik's vengeful pursuit of an ambitious mutant who ruined his life causes a schism to divide them."
Who is the Director of X: First Class?,"The Director of X: First Class is Matthew Vaughn. Summary: In the 1960s, superpowered humans Charles Xavier and Erik Lensherr work together to find others like them, but Erik's vengeful pursuit of an ambitious mutant who ruined his life causes a schism to divide them."
What is the IMDB Rating of X: First Class?,"The IMDB Rating of X: First Class is 7.7. Summary: In the 1960s, superpowered humans Charles Xavier and Erik Lensherr work together to find others like them, but Erik's vengeful pursuit of an ambitious mutant who ruined his life causes a schism to divide them."
What is the Runtime of X: First Class?,"The Runtime of X: First Class is 131. Summary: In the 1960s, superpowered humans Charles Xavier and Erik Lensherr work together to find others like them, but Erik's vengeful pursuit of an ambitious mutant who ruined his life causes a schism to divide them."
What is the Genre of The Hangover?,"The Hangover is of Comedy genre. Summary: Three buddies wake up from a bachelor party in Las Vegas, with no memory of the previous night and the bachelor missing. They make their way around the city in order to find their friend before his wedding."
Who is the Director of The Hangover?,"The Director of The Hangover is Todd Phillips. Summary: Three buddies wake up from a bachelor party in Las Vegas, with no memory of the previous night and the bachelor missing. They make their way around the city in order to find their friend before his wedding."
What is the IMDB Rating of The Hangover?,"The IMDB Rating of The Hangover is 7.7. Summary: Three buddies wake up from a bachelor party in Las Vegas, with no memory of the previous night and the bachelor missing. They make their way around the city in order to find their friend before his wedding."
What is the Runtime of The Hangover?,"The Runtime of The Hangover is 100. Summary: Three buddies wake up from a bachelor party in Las Vegas, with no memory of the previous night and the bachelor missing. They make their way around the city in order to find their friend before his wedding."
What is the Genre of Skyfall?,"Skyfall is of Action, Adventure, Thriller genre. Summary: James Bond's loyalty to M is tested when her past comes back to haunt her. When MI6 comes under attack, 007 must track down and destroy the threat, no matter how personal the cost."
Who is the Director of Skyfall?,"The Director of Skyfall is Sam Mendes. Summary: James Bond's loyalty to M is tested when her past comes back to haunt her. When MI6 comes under attack, 007 must track down and destroy the threat, no matter how personal the cost."
What is the IMDB Rating of Skyfall?,"The IMDB Rating of Skyfall is 7.7. Summary: James Bond's loyalty to M is tested when her past comes back to haunt her. When MI6 comes under attack, 007 must track down and destroy the threat, no matter how personal the cost."
What is the Runtime of Skyfall?,"The Runtime of Skyfall is 143. Summary: James Bond's loyalty to M is tested when her past comes back to haunt her. When MI6 comes under attack, 007 must track down and destroy the threat, no matter how personal the cost."
What is the Genre of Silver Linings Playbook?,"Silver Linings Playbook is of Comedy, Drama, Romance genre. Summary: After a stint in a mental institution, former teacher Pat Solitano moves back in with his parents and tries to reconcile with his ex-wife. Things get more challenging when Pat meets Tiffany, a mysterious girl with problems of her own."
Who is the Director of Silver Linings Playbook?,"The Director of Silver Linings Playbook is David O. Russell. Summary: After a stint in a mental institution, former teacher Pat Solitano moves back in with his parents and tries to reconcile with his ex-wife. Things get more challenging when Pat meets Tiffany, a mysterious girl with problems of her own."
What is the IMDB Rating of Silver Linings Playbook?,"The IMDB Rating of Silver Linings Playbook is 7.7. Summary: After a stint in a mental institution, former teacher Pat Solitano moves back in with his parents and tries to reconcile with his ex-wife. Things get more challenging when Pat meets Tiffany, a mysterious girl with problems of her own."
What is the Runtime of Silver Linings Playbook?,"The Runtime of Silver Linings Playbook is 122. Summary: After a stint in a mental institution, former teacher Pat Solitano moves back in with his parents and tries to reconcile with his ex-wife. Things get more challenging when Pat meets Tiffany, a mysterious girl with problems of her own."
What is the Genre of Argo?,"Argo is of Biography, Drama, Thriller genre. Summary: Acting under the cover of a Hollywood producer scouting a location for a science fiction film, a CIA agent launches a dangerous operation to rescue six Americans in Tehran during the U.S. hostage crisis in Iran in 1979."
Who is the Director of Argo?,"The Director of Argo is Ben Affleck. Summary: Acting under the cover of a Hollywood producer scouting a location for a science fiction film, a CIA agent launches a dangerous operation to rescue six Americans in Tehran during the U.S. hostage crisis in Iran in 1979."
What is the IMDB Rating of Argo?,"The IMDB Rating of Argo is 7.7. Summary: Acting under the cover of a Hollywood producer scouting a location for a science fiction film, a CIA agent launches a dangerous operation to rescue six Americans in Tehran during the U.S. hostage crisis in Iran in 1979."
What is the Runtime of Argo?,"The Runtime of Argo is 120. Summary: Acting under the cover of a Hollywood producer scouting a location for a science fiction film, a CIA agent launches a dangerous operation to rescue six Americans in Tehran during the U.S. hostage crisis in Iran in 1979."
What is the Genre of (500) Days of Summer?,"(500) Days of Summer is of Comedy, Drama, Romance genre. Summary: An offbeat romantic comedy about a woman who doesn't believe true love exists, and the young man who falls for her."
Who is the Director of (500) Days of Summer?,"The Director of (500) Days of Summer is Marc Webb. Summary: An offbeat romantic comedy about a woman who doesn't believe true love exists, and the young man who falls for her."
What is the IMDB Rating of (500) Days of Summer?,"The IMDB Rating of (500) Days of Summer is 7.7. Summary: An offbeat romantic comedy about a woman who doesn't believe true love exists, and the young man who falls for her."
What is the Runtime of (500) Days of Summer?,"The Runtime of (500) Days of Summer is 95. Summary: An offbeat romantic comedy about a woman who doesn't believe true love exists, and the young man who falls for her."
What is the Genre of Harry Potter and the Deathly Hallows: Part 1?,"Harry Potter and the Deathly Hallows: Part 1 is of Adventure, Family, Fantasy genre. Summary: As Harry, Ron, and Hermione race against time and evil to destroy the Horcruxes, they uncover the existence of the three most powerful objects in the wizarding world: the Deathly Hallows."
Who is the Director of Harry Potter and the Deathly Hallows: Part 1?,"The Director of Harry Potter and the Deathly Hallows: Part 1 is David Yates. Summary: As Harry, Ron, and Hermione race against time and evil to destroy the Horcruxes, they uncover the existence of the three most powerful objects in the wizarding world: the Deathly Hallows."
What is the IMDB Rating of Harry Potter and the Deathly Hallows: Part 1?,"The IMDB Rating of Harry Potter and the Deathly Hallows: Part 1 is 7.7. Summary: As Harry, Ron, and Hermione race against time and evil to destroy the Horcruxes, they uncover the existence of the three most powerful objects in the wizarding world: the Deathly Hallows."
What is the Runtime of Harry Potter and the Deathly Hallows: Part 1?,"The Runtime of Harry Potter and the Deathly Hallows: Part 1 is 146. Summary: As Harry, Ron, and Hermione race against time and evil to destroy the Horcruxes, they uncover the existence of the three most powerful objects in the wizarding world: the Deathly Hallows."
What is the Genre of Gake no ue no Ponyo?,"Gake no ue no Ponyo is of Animation, Adventure, Comedy genre. Summary: A five-year-old boy develops a relationship with Ponyo, a young goldfish princess who longs to become a human after falling in love with him."
Who is the Director of Gake no ue no Ponyo?,"The Director of Gake no ue no Ponyo is Hayao Miyazaki. Summary: A five-year-old boy develops a relationship with Ponyo, a young goldfish princess who longs to become a human after falling in love with him."
What is the IMDB Rating of Gake no ue no Ponyo?,"The IMDB Rating of Gake no ue no Ponyo is 7.7. Summary: A five-year-old boy develops a relationship with Ponyo, a young goldfish princess who longs to become a human after falling in love with him."
What is the Runtime of Gake no ue no Ponyo?,"The Runtime of Gake no ue no Ponyo is 101. Summary: A five-year-old boy develops a relationship with Ponyo, a young goldfish princess who longs to become a human after falling in love with him."
What is the Genre of Frost/Nixon?,"Frost/Nixon is of Biography, Drama, History genre. Summary: A dramatic retelling of the post-Watergate television interviews between British talk-show host David Frost and former president Richard Nixon."
Who is the Director of Frost/Nixon?,The Director of Frost/Nixon is Ron Howard. Summary: A dramatic retelling of the post-Watergate television interviews between British talk-show host David Frost and former president Richard Nixon.
What is the IMDB Rating of Frost/Nixon?,The IMDB Rating of Frost/Nixon is 7.7. Summary: A dramatic retelling of the post-Watergate television interviews between British talk-show host David Frost and former president Richard Nixon.
What is the Runtime of Frost/Nixon?,The Runtime of Frost/Nixon is 122. Summary: A dramatic retelling of the post-Watergate television interviews between British talk-show host David Frost and former president Richard Nixon.
What is the Genre of Papurika?,"Papurika is of Animation, Drama, Fantasy genre. Summary: When a machine that allows therapists to enter their patients' dreams is stolen, all Hell breaks loose. Only a young female therapist, Paprika, can stop it."
Who is the Director of Papurika?,"The Director of Papurika is Satoshi Kon. Summary: When a machine that allows therapists to enter their patients' dreams is stolen, all Hell breaks loose. Only a young female therapist, Paprika, can stop it."
What is the IMDB Rating of Papurika?,"The IMDB Rating of Papurika is 7.7. Summary: When a machine that allows therapists to enter their patients' dreams is stolen, all Hell breaks loose. Only a young female therapist, Paprika, can stop it."
What is the Runtime of Papurika?,"The Runtime of Papurika is 90. Summary: When a machine that allows therapists to enter their patients' dreams is stolen, all Hell breaks loose. Only a young female therapist, Paprika, can stop it."
What is the Genre of Changeling?,"Changeling is of Biography, Crime, Drama genre. Summary: Grief-stricken mother Christine Collins (Angelina Jolie) takes on the L.A.P.D. to her own detriment when it tries to pass off an obvious impostor as her missing child."
Who is the Director of Changeling?,The Director of Changeling is Clint Eastwood. Summary: Grief-stricken mother Christine Collins (Angelina Jolie) takes on the L.A.P.D. to her own detriment when it tries to pass off an obvious impostor as her missing child.
What is the IMDB Rating of Changeling?,The IMDB Rating of Changeling is 7.7. Summary: Grief-stricken mother Christine Collins (Angelina Jolie) takes on the L.A.P.D. to her own detriment when it tries to pass off an obvious impostor as her missing child.
What is the Runtime of Changeling?,The Runtime of Changeling is 141. Summary: Grief-stricken mother Christine Collins (Angelina Jolie) takes on the L.A.P.D. to her own detriment when it tries to pass off an obvious impostor as her missing child.
What is the Genre of Flipped?,"Flipped is of Comedy, Drama, Romance genre. Summary: Two eighth-graders start to have feelings for each other despite being total opposites."
Who is the Director of Flipped?,The Director of Flipped is Rob Reiner. Summary: Two eighth-graders start to have feelings for each other despite being total opposites.
What is the IMDB Rating of Flipped?,The IMDB Rating of Flipped is 7.7. Summary: Two eighth-graders start to have feelings for each other despite being total opposites.
What is the Runtime of Flipped?,The Runtime of Flipped is 90. Summary: Two eighth-graders start to have feelings for each other despite being total opposites.
What is the Genre of Toki o kakeru shôjo?,"Toki o kakeru shôjo is of Animation, Adventure, Comedy genre. Summary: A high-school girl named Makoto acquires the power to travel back in time, and decides to use it for her own personal benefits. Little does she know that she is affecting the lives of others just as much as she is her own."
Who is the Director of Toki o kakeru shôjo?,"The Director of Toki o kakeru shôjo is Mamoru Hosoda. Summary: A high-school girl named Makoto acquires the power to travel back in time, and decides to use it for her own personal benefits. Little does she know that she is affecting the lives of others just as much as she is her own."
