Question,Answer
What is the IMDB Rating of Million Dollar Baby?,The IMDB Rating of Million Dollar Baby is 8.1. Summary: A determined woman works with a hardened boxing trainer to become a professional.
What is the Runtime of Million Dollar Baby?,The Runtime of Million Dollar Baby is 132. Summary: A determined woman works with a hardened boxing trainer to become a professional.
What is the Genre of Hotel Rwanda?,"Hotel Rwanda is of Biography, Drama, History genre. Summary: Paul Rusesabagina, a hotel manager, houses over a thousand Tutsi refugees during their struggle against the Hutu militia in Rwanda, Africa."
Who is the Director of Hotel Rwanda?,"The Director of Hotel Rwanda is Terry George. Summary: Paul Rusesabagina, a hotel manager, houses over a thousand Tutsi refugees during their struggle against the Hutu militia in Rwanda, Africa."
What is the IMDB Rating of Hotel Rwanda?,"The IMDB Rating of Hotel Rwanda is 8.1. Summary: Paul Rusesabagina, a hotel manager, houses over a thousand Tutsi refugees during their struggle against the Hutu militia in Rwanda, Africa."
What is the Runtime of Hotel Rwanda?,"The Runtime of Hotel Rwanda is 121. Summary: Paul Rusesabagina, a hotel manager, houses over a thousand Tutsi refugees during their struggle against the Hutu militia in Rwanda, Africa."
What is the Genre of Taegukgi hwinalrimyeo?,"Taegukgi hwinalrimyeo is of Action, Drama, War genre. Summary: When two brothers are forced to fight in the Korean War, the elder decides to take the riskiest missions if it will help shield the younger from battle."
Who is the Director of Taegukgi hwinalrimyeo?,"The Director of Taegukgi hwinalrimyeo is Je-kyu Kang. Summary: When two brothers are forced to fight in the Korean War, the elder decides to take the riskiest missions if it will help shield the younger from battle."
What is the IMDB Rating of Taegukgi hwinalrimyeo?,"The IMDB Rating of Taegukgi hwinalrimyeo is 8.1. Summary: When two brothers are forced to fight in the Korean War, the elder decides to take the riskiest missions if it will help shield the younger from battle."
What is the Runtime of Taegukgi hwinalrimyeo?,"The Runtime of Taegukgi hwinalrimyeo is 140. Summary: When two brothers are forced to fight in the Korean War, the elder decides to take the riskiest missions if it will help shield the younger from battle."
What is the Genre of Before Sunset?,"Before Sunset is of Drama, Romance genre. Summary: Nine years after Jesse and Celine first met, they encounter each other again on the French leg of Jesse's book tour."
Who is the Director of Before Sunset?,"The Director of Before Sunset is Richard Linklater. Summary: Nine years after Jesse and Celine first met, they encounter each other again on the French leg of Jesse's book tour."
What is the IMDB Rating of Before Sunset?,"The IMDB Rating of Before Sunset is 8.1. Summary: Nine years after Jesse and Celine first met, they encounter each other again on the French leg of Jesse's book tour."
What is the Runtime of Before Sunset?,"The Runtime of Before Sunset is 80. Summary: Nine years after Jesse and Celine first met, they encounter each other again on the French leg of Jesse's book tour."
What is the Genre of Munna Bhai M.B.B.S.?,"Munna Bhai M.B.B.S. is of Comedy, Drama, Musical genre. Summary: A gangster sets out to fulfill his father's dream of becoming a doctor."
Who is the Director of Munna Bhai M.B.B.S.?,The Director of Munna Bhai M.B.B.S. is Rajkumar Hirani. Summary: A gangster sets out to fulfill his father's dream of becoming a doctor.
What is the IMDB Rating of Munna Bhai M.B.B.S.?,The IMDB Rating of Munna Bhai M.B.B.S. is 8.1. Summary: A gangster sets out to fulfill his father's dream of becoming a doctor.
What is the Runtime of Munna Bhai M.B.B.S.?,The Runtime of Munna Bhai M.B.B.S. is 156. Summary: A gangster sets out to fulfill his father's dream of becoming a doctor.
What is the Genre of Salinui chueok?,"Salinui chueok is of Crime, Drama, Mystery genre. Summary: In a small Korean province in 1986, two detectives struggle with the case of multiple young women being found raped and murdered by an unknown culprit."
Who is the Director of Salinui chueok?,"The Director of Salinui chueok is Bong Joon Ho. Summary: In a small Korean province in 1986, two detectives struggle with the case of multiple young women being found raped and murdered by an unknown culprit."
What is the IMDB Rating of Salinui chueok?,"The IMDB Rating of Salinui chueok is 8.1. Summary: In a small Korean province in 1986, two detectives struggle with the case of multiple young women being found raped and murdered by an unknown culprit."
What is the Runtime of Salinui chueok?,"The Runtime of Salinui chueok is 131. Summary: In a small Korean province in 1986, two detectives struggle with the case of multiple young women being found raped and murdered by an unknown culprit."
What is the Genre of Dil Chahta Hai?,"Dil Chahta Hai is of Comedy, Drama, Romance genre. Summary: Three inseparable childhood friends are just out of college. Nothing comes between them - until they each fall in love, and their wildly different approaches to relationships creates tension."
Who is the Director of Dil Chahta Hai?,"The Director of Dil Chahta Hai is Farhan Akhtar. Summary: Three inseparable childhood friends are just out of college. Nothing comes between them - until they each fall in love, and their wildly different approaches to relationships creates tension."
What is the IMDB Rating of Dil Chahta Hai?,"The IMDB Rating of Dil Chahta Hai is 8.1. Summary: Three inseparable childhood friends are just out of college. Nothing comes between them - until they each fall in love, and their wildly different approaches to relationships creates tension."
What is the Runtime of Dil Chahta Hai?,"The Runtime of Dil Chahta Hai is 183. Summary: Three inseparable childhood friends are just out of college. Nothing comes between them - until they each fall in love, and their wildly different approaches to relationships creates tension."
What is the Genre of Kill Bill: Vol. 1?,"Kill Bill: Vol. 1 is of Action, Crime, Drama genre. Summary: After awakening from a four-year coma, a former assassin wreaks vengeance on the team of assassins who betrayed her."
Who is the Director of Kill Bill: Vol. 1?,"The Director of Kill Bill: Vol. 1 is Quentin Tarantino. Summary: After awakening from a four-year coma, a former assassin wreaks vengeance on the team of assassins who betrayed her."
What is the IMDB Rating of Kill Bill: Vol. 1?,"The IMDB Rating of Kill Bill: Vol. 1 is 8.1. Summary: After awakening from a four-year coma, a former assassin wreaks vengeance on the team of assassins who betrayed her."
What is the Runtime of Kill Bill: Vol. 1?,"The Runtime of Kill Bill: Vol. 1 is 111. Summary: After awakening from a four-year coma, a former assassin wreaks vengeance on the team of assassins who betrayed her."
What is the Genre of Finding Nemo?,"Finding Nemo is of Animation, Adventure, Comedy genre. Summary: After his son is captured in the Great Barrier Reef and taken to Sydney, a timid clownfish sets out on a journey to bring him home."
Who is the Director of Finding Nemo?,"The Director of Finding Nemo is Andrew Stanton. Summary: After his son is captured in the Great Barrier Reef and taken to Sydney, a timid clownfish sets out on a journey to bring him home."
What is the IMDB Rating of Finding Nemo?,"The IMDB Rating of Finding Nemo is 8.1. Summary: After his son is captured in the Great Barrier Reef and taken to Sydney, a timid clownfish sets out on a journey to bring him home."
What is the Runtime of Finding Nemo?,"The Runtime of Finding Nemo is 100. Summary: After his son is captured in the Great Barrier Reef and taken to Sydney, a timid clownfish sets out on a journey to bring him home."
What is the Genre of Catch Me If You Can?,"Catch Me If You Can is of Biography, Crime, Drama genre. Summary: Barely 21 yet, Frank is a skilled forger who has passed as a doctor, lawyer and pilot. FBI agent Carl becomes obsessed with tracking down the con man, who only revels in the pursuit."
Who is the Director of Catch Me If You Can?,"The Director of Catch Me If You Can is Steven Spielberg. Summary: Barely 21 yet, Frank is a skilled forger who has passed as a doctor, lawyer and pilot. FBI agent Carl becomes obsessed with tracking down the con man, who only revels in the pursuit."
What is the IMDB Rating of Catch Me If You Can?,"The IMDB Rating of Catch Me If You Can is 8.1. Summary: Barely 21 yet, Frank is a skilled forger who has passed as a doctor, lawyer and pilot. FBI agent Carl becomes obsessed with tracking down the con man, who only revels in the pursuit."
What is the Runtime of Catch Me If You Can?,"The Runtime of Catch Me If You Can is 141. Summary: Barely 21 yet, Frank is a skilled forger who has passed as a doctor, lawyer and pilot. FBI agent Carl becomes obsessed with tracking down the con man, who only revels in the pursuit."
What is the Genre of Amores perros?,"Amores perros is of Drama, Thriller genre. Summary: A horrific car accident connects three stories, each involving characters dealing with loss, regret, and life's harsh realities, all in the name of love."
Who is the Director of Amores perros?,"The Director of Amores perros is Alejandro G. Iñárritu. Summary: A horrific car accident connects three stories, each involving characters dealing with loss, regret, and life's harsh realities, all in the name of love."
What is the IMDB Rating of Amores perros?,"The IMDB Rating of Amores perros is 8.1. Summary: A horrific car accident connects three stories, each involving characters dealing with loss, regret, and life's harsh realities, all in the name of love."
What is the Runtime of Amores perros?,"The Runtime of Amores perros is 154. Summary: A horrific car accident connects three stories, each involving characters dealing with loss, regret, and life's harsh realities, all in the name of love."
"What is the Genre of Monsters, Inc.?","Monsters, Inc. is of Animation, Adventure, Comedy genre. Summary: In order to power the city, monsters have to scare children so that they scream. However, the children are toxic to the monsters, and after a child gets through, 2 monsters realize things may not be what they think."
"Who is the Director of Monsters, Inc.?","The Director of Monsters, Inc. is Pete Docter. Summary: In order to power the city, monsters have to scare children so that they scream. However, the children are toxic to the monsters, and after a child gets through, 2 monsters realize things may not be what they think."
"What is the IMDB Rating of Monsters, Inc.?","The IMDB Rating of Monsters, Inc. is 8.1. Summary: In order to power the city, monsters have to scare children so that they scream. However, the children are toxic to the monsters, and after a child gets through, 2 monsters realize things may not be what they think."
"What is the Runtime of Monsters, Inc.?","The Runtime of Monsters, Inc. is 92. Summary: In order to power the city, monsters have to scare children so that they scream. However, the children are toxic to the monsters, and after a child gets through, 2 monsters realize things may not be what they think."
"What is the Genre of Shin seiki Evangelion Gekijô-ban: Air/Magokoro wo, kimi ni?","Shin seiki Evangelion Gekijô-ban: Air/Magokoro wo, kimi ni is of Animation, Action, Drama genre. Summary: Concurrent theatrical ending of the TV series Shin seiki evangerion (1995)."
"Who is the Director of Shin seiki Evangelion Gekijô-ban: Air/Magokoro wo, kimi ni?","The Director of Shin seiki Evangelion Gekijô-ban: Air/Magokoro wo, kimi ni is Hideaki Anno. Summary: Concurrent theatrical ending of the TV series Shin seiki evangerion (1995)."
"What is the IMDB Rating of Shin seiki Evangelion Gekijô-ban: Air/Magokoro wo, kimi ni?","The IMDB Rating of Shin seiki Evangelion Gekijô-ban: Air/Magokoro wo, kimi ni is 8.1. Summary: Concurrent theatrical ending of the TV series Shin seiki evangerion (1995)."
"What is the Runtime of Shin seiki Evangelion Gekijô-ban: Air/Magokoro wo, kimi ni?","The Runtime of Shin seiki Evangelion Gekijô-ban: Air/Magokoro wo, kimi ni is 87. Summary: Concurrent theatrical ending of the TV series Shin seiki evangerion (1995)."
What is the Genre of Lagaan: Once Upon a Time in India?,"Lagaan: Once Upon a Time in India is of Adventure, Drama, Musical genre. Summary: The people of a small village in Victorian India stake their future on a game of cricket against their ruthless British rulers."
Who is the Director of Lagaan: Once Upon a Time in India?,The Director of Lagaan: Once Upon a Time in India is Ashutosh Gowariker. Summary: The people of a small village in Victorian India stake their future on a game of cricket against their ruthless British rulers.
What is the IMDB Rating of Lagaan: Once Upon a Time in India?,The IMDB Rating of Lagaan: Once Upon a Time in India is 8.1. Summary: The people of a small village in Victorian India stake their future on a game of cricket against their ruthless British rulers.
What is the Runtime of Lagaan: Once Upon a Time in India?,The Runtime of Lagaan: Once Upon a Time in India is 224. Summary: The people of a small village in Victorian India stake their future on a game of cricket against their ruthless British rulers.
What is the Genre of The Sixth Sense?,"The Sixth Sense is of Drama, Mystery, Thriller genre. Summary: A boy who communicates with spirits seeks the help of a disheartened child psychologist."
Who is the Director of The Sixth Sense?,The Director of The Sixth Sense is M. Night Shyamalan. Summary: A boy who communicates with spirits seeks the help of a disheartened child psychologist.
What is the IMDB Rating of The Sixth Sense?,The IMDB Rating of The Sixth Sense is 8.1. Summary: A boy who communicates with spirits seeks the help of a disheartened child psychologist.
What is the Runtime of The Sixth Sense?,The Runtime of The Sixth Sense is 107. Summary: A boy who communicates with spirits seeks the help of a disheartened child psychologist.
What is the Genre of La leggenda del pianista sull'oceano?,"La leggenda del pianista sull'oceano is of Drama, Music, Romance genre. Summary: A baby boy, discovered in 1900 on an ocean liner, grows into a musical prodigy, never setting foot on land."
Who is the Director of La leggenda del pianista sull'oceano?,"The Director of La leggenda del pianista sull'oceano is Giuseppe Tornatore. Summary: A baby boy, discovered in 1900 on an ocean liner, grows into a musical prodigy, never setting foot on land."
What is the IMDB Rating of La leggenda del pianista sull'oceano?,"The IMDB Rating of La leggenda del pianista sull'oceano is 8.1. Summary: A baby boy, discovered in 1900 on an ocean liner, grows into a musical prodigy, never setting foot on land."
What is the Runtime of La leggenda del pianista sull'oceano?,"The Runtime of La leggenda del pianista sull'oceano is 169. Summary: A baby boy, discovered in 1900 on an ocean liner, grows into a musical prodigy, never setting foot on land."
What is the Genre of The Truman Show?,"The Truman Show is of Comedy, Drama genre. Summary: An insurance salesman discovers his whole life is actually a reality TV show."
Who is the Director of The Truman Show?,The Director of The Truman Show is Peter Weir. Summary: An insurance salesman discovers his whole life is actually a reality TV show.
What is the IMDB Rating of The Truman Show?,The IMDB Rating of The Truman Show is 8.1. Summary: An insurance salesman discovers his whole life is actually a reality TV show.
What is the Runtime of The Truman Show?,The Runtime of The Truman Show is 103. Summary: An insurance salesman discovers his whole life is actually a reality TV show.
"What is the Genre of Crna macka, beli macor?","Crna macka, beli macor is of Comedy, Crime, Romance genre. Summary: Matko and his son Zare live on the banks of the Danube river and get by through hustling and basically doing anything to make a living. In order to pay off a business debt Matko agrees to marry off Zare to the sister of a local gangster."
"Who is the Director of Crna macka, beli macor?","The Director of Crna macka, beli macor is Emir Kusturica. Summary: Matko and his son Zare live on the banks of the Danube river and get by through hustling and basically doing anything to make a living. In order to pay off a business debt Matko agrees to marry off Zare to the sister of a local gangster."
"What is the IMDB Rating of Crna macka, beli macor?","The IMDB Rating of Crna macka, beli macor is 8.1. Summary: Matko and his son Zare live on the banks of the Danube river and get by through hustling and basically doing anything to make a living. In order to pay off a business debt Matko agrees to marry off Zare to the sister of a local gangster."
"What is the Runtime of Crna macka, beli macor?","The Runtime of Crna macka, beli macor is 127. Summary: Matko and his son Zare live on the banks of the Danube river and get by through hustling and basically doing anything to make a living. In order to pay off a business debt Matko agrees to marry off Zare to the sister of a local gangster."
What is the Genre of The Big Lebowski?,"The Big Lebowski is of Comedy, Crime, Sport genre. Summary: Jeff ""The Dude"" Lebowski, mistaken for a millionaire of the same name, seeks restitution for his ruined rug and enlists his bowling buddies to help get it."
Who is the Director of The Big Lebowski?,"The Director of The Big Lebowski is Joel Coen. Summary: Jeff ""The Dude"" Lebowski, mistaken for a millionaire of the same name, seeks restitution for his ruined rug and enlists his bowling buddies to help get it."
What is the IMDB Rating of The Big Lebowski?,"The IMDB Rating of The Big Lebowski is 8.1. Summary: Jeff ""The Dude"" Lebowski, mistaken for a millionaire of the same name, seeks restitution for his ruined rug and enlists his bowling buddies to help get it."
What is the Runtime of The Big Lebowski?,"The Runtime of The Big Lebowski is 117. Summary: Jeff ""The Dude"" Lebowski, mistaken for a millionaire of the same name, seeks restitution for his ruined rug and enlists his bowling buddies to help get it."
What is the Genre of Fa yeung nin wah?,"Fa yeung nin wah is of Drama, Romance genre. Summary: Two neighbors, a woman and a man, form a strong bond after both suspect extramarital activities of their spouses. However, they agree to keep their bond platonic so as not to commit similar wrongs."
Who is the Director of Fa yeung nin wah?,"The Director of Fa yeung nin wah is Kar-Wai Wong. Summary: Two neighbors, a woman and a man, form a strong bond after both suspect extramarital activities of their spouses. However, they agree to keep their bond platonic so as not to commit similar wrongs."
What is the IMDB Rating of Fa yeung nin wah?,"The IMDB Rating of Fa yeung nin wah is 8.1. Summary: Two neighbors, a woman and a man, form a strong bond after both suspect extramarital activities of their spouses. However, they agree to keep their bond platonic so as not to commit similar wrongs."
What is the Runtime of Fa yeung nin wah?,"The Runtime of Fa yeung nin wah is 98. Summary: Two neighbors, a woman and a man, form a strong bond after both suspect extramarital activities of their spouses. However, they agree to keep their bond platonic so as not to commit similar wrongs."
What is the Genre of Trainspotting?,"Trainspotting is of Drama genre. Summary: Renton, deeply immersed in the Edinburgh drug scene, tries to clean up and get out, despite the allure of the drugs and influence of friends."
Who is the Director of Trainspotting?,"The Director of Trainspotting is Danny Boyle. Summary: Renton, deeply immersed in the Edinburgh drug scene, tries to clean up and get out, despite the allure of the drugs and influence of friends."
What is the IMDB Rating of Trainspotting?,"The IMDB Rating of Trainspotting is 8.1. Summary: Renton, deeply immersed in the Edinburgh drug scene, tries to clean up and get out, despite the allure of the drugs and influence of friends."
What is the Runtime of Trainspotting?,"The Runtime of Trainspotting is 93. Summary: Renton, deeply immersed in the Edinburgh drug scene, tries to clean up and get out, despite the allure of the drugs and influence of friends."
What is the Genre of Fargo?,"Fargo is of Crime, Drama, Thriller genre. Summary: Jerry Lundegaard's inept crime falls apart due to his and his henchmen's bungling and the persistent police work of the quite pregnant Marge Gunderson."
Who is the Director of Fargo?,The Director of Fargo is Joel Coen. Summary: Jerry Lundegaard's inept crime falls apart due to his and his henchmen's bungling and the persistent police work of the quite pregnant Marge Gunderson.
What is the IMDB Rating of Fargo?,The IMDB Rating of Fargo is 8.1. Summary: Jerry Lundegaard's inept crime falls apart due to his and his henchmen's bungling and the persistent police work of the quite pregnant Marge Gunderson.
What is the Runtime of Fargo?,The Runtime of Fargo is 98. Summary: Jerry Lundegaard's inept crime falls apart due to his and his henchmen's bungling and the persistent police work of the quite pregnant Marge Gunderson.
What is the Genre of Underground?,"Underground is of Comedy, Drama, War genre. Summary: A group of Serbian socialists prepares for the war in a surreal underground filled by parties, tragedies, love and hate."
Who is the Director of Underground?,"The Director of Underground is Emir Kusturica. Summary: A group of Serbian socialists prepares for the war in a surreal underground filled by parties, tragedies, love and hate."
What is the IMDB Rating of Underground?,"The IMDB Rating of Underground is 8.1. Summary: A group of Serbian socialists prepares for the war in a surreal underground filled by parties, tragedies, love and hate."
What is the Runtime of Underground?,"The Runtime of Underground is 170. Summary: A group of Serbian socialists prepares for the war in a surreal underground filled by parties, tragedies, love and hate."
What is the Genre of La haine?,"La haine is of Crime, Drama genre. Summary: 24 hours in the lives of three young men in the French suburbs the day after a violent riot."
Who is the Director of La haine?,The Director of La haine is Mathieu Kassovitz. Summary: 24 hours in the lives of three young men in the French suburbs the day after a violent riot.
What is the IMDB Rating of La haine?,The IMDB Rating of La haine is 8.1. Summary: 24 hours in the lives of three young men in the French suburbs the day after a violent riot.
What is the Runtime of La haine?,The Runtime of La haine is 98. Summary: 24 hours in the lives of three young men in the French suburbs the day after a violent riot.
What is the Genre of Dilwale Dulhania Le Jayenge?,"Dilwale Dulhania Le Jayenge is of Drama, Romance genre. Summary: When Raj meets Simran in Europe, it isn't love at first sight but when Simran moves to India for an arranged marriage, love makes its presence felt."
Who is the Director of Dilwale Dulhania Le Jayenge?,"The Director of Dilwale Dulhania Le Jayenge is Aditya Chopra. Summary: When Raj meets Simran in Europe, it isn't love at first sight but when Simran moves to India for an arranged marriage, love makes its presence felt."
What is the IMDB Rating of Dilwale Dulhania Le Jayenge?,"The IMDB Rating of Dilwale Dulhania Le Jayenge is 8.1. Summary: When Raj meets Simran in Europe, it isn't love at first sight but when Simran moves to India for an arranged marriage, love makes its presence felt."
What is the Runtime of Dilwale Dulhania Le Jayenge?,"The Runtime of Dilwale Dulhania Le Jayenge is 189. Summary: When Raj meets Simran in Europe, it isn't love at first sight but when Simran moves to India for an arranged marriage, love makes its presence felt."
What is the Genre of Before Sunrise?,"Before Sunrise is of Drama, Romance genre. Summary: A young man and woman meet on a train in Europe, and wind up spending one evening together in Vienna. Unfortunately, both know that this will probably be their only night together."
Who is the Director of Before Sunrise?,"The Director of Before Sunrise is Richard Linklater. Summary: A young man and woman meet on a train in Europe, and wind up spending one evening together in Vienna. Unfortunately, both know that this will probably be their only night together."
What is the IMDB Rating of Before Sunrise?,"The IMDB Rating of Before Sunrise is 8.1. Summary: A young man and woman meet on a train in Europe, and wind up spending one evening together in Vienna. Unfortunately, both know that this will probably be their only night together."
What is the Runtime of Before Sunrise?,"The Runtime of Before Sunrise is 101. Summary: A young man and woman meet on a train in Europe, and wind up spending one evening together in Vienna. Unfortunately, both know that this will probably be their only night together."
What is the Genre of Trois couleurs: Rouge?,"Trois couleurs: Rouge is of Drama, Mystery, Romance genre. Summary: A model discovers a retired judge is keen on invading people's privacy."
Who is the Director of Trois couleurs: Rouge?,The Director of Trois couleurs: Rouge is Krzysztof Kieslowski. Summary: A model discovers a retired judge is keen on invading people's privacy.
What is the IMDB Rating of Trois couleurs: Rouge?,The IMDB Rating of Trois couleurs: Rouge is 8.1. Summary: A model discovers a retired judge is keen on invading people's privacy.
What is the Runtime of Trois couleurs: Rouge?,The Runtime of Trois couleurs: Rouge is 99. Summary: A model discovers a retired judge is keen on invading people's privacy.
What is the Genre of Chung Hing sam lam?,"Chung Hing sam lam is of Comedy, Crime, Drama genre. Summary: Two melancholy Hong Kong policemen fall in love: one with a mysterious female underworld figure, the other with a beautiful and ethereal server at a late-night restaurant he frequents."
